{
  "$schema": "../schemas/registry_config.schema.json",
  "tileSize": 32,
  "scale": 2,
  "entities": {
    "PlayerSpawn": { "required": ["x", "y"] },
    "NPC": { "required": ["x", "y", "inkKnot"], "optional": ["sprite", "name"] },
    "EncounterTrigger": { "required": ["x", "y", "deckTag", "count"], "optional": ["rewardId"] },
    "Door": { "required": ["x", "y", "targetLevel"], "optional": ["locked", "requiredItem"] },
    "OutfitChest": { "required": ["x", "y", "outfitId"] }
  },
  "outfits": {
    "default": { "id": "default", "name": "Street Clothes", "sprite": "player_default", "buffs": {} },
    "evidence_blazer": { "id": "evidence_blazer", "name": "Evidence Blazer", "sprite": "player_blazer", "buffs": { "hints": 1 } },
    "civpro_suit": { "id": "civpro_suit", "name": "Civ Pro Power Suit", "sprite": "player_suit", "buffs": { "strike": 1 } },
    "conlaw_robe": { "id": "conlaw_robe", "name": "Con Law Robe", "sprite": "player_robe", "buffs": { "extraTime": 5 } },
    "court_blazer": { "id": "court_blazer", "name": "Court Blazer", "sprite": "player_court", "buffs": { "citationBonus": 10 } },
    "power_suit": { "id": "power_suit", "name": "Power Suit", "sprite": "player_power", "buffs": { "hints": 1, "citationBonus": 5 } }
  },
  "tags": {
    "subjects": [
      "agency",
      "business_associations",
      "civil_procedure",
      "community_property",
      "conflict_of_laws",
      "constitutional_law",
      "contracts",
      "criminal_law",
      "criminal_procedure",
      "evidence",
      "family_law",
      "federal_income_tax",
      "oil_gas",
      "property",
      "torts",
      "trusts_and_estates"
    ],
    "topicTags": []
  }
}
